Path to Cutadapt set as: 'cutadapt' (default)
Cutadapt seems to be working fine (tested command 'cutadapt --version')
Cutadapt version: 3.4
Could not detect version of Python used by Cutadapt from the first line of Cutadapt (but found this: >>>#!/bin/sh<<<)
Letting the (modified) Cutadapt deal with the Python version instead
pigz 2.6
Parallel gzip (pigz) detected. Proceeding with multicore (de)compression using 2 cores

No quality encoding type selected. Assuming that the data provided uses Sanger encoded Phred scores (default)

Output will be written into the directory: /home/lkemp/snakemake_workshop/demo_workflow/results/trimmed/


AUTO-DETECTING ADAPTER TYPE
===========================
Attempting to auto-detect adapter type from the first 1 million sequences of the first file (>> ../../data/NA24694_1.fastq.gz <<)

Found perfect matches for the following adapter sequences:
Adapter type	Count	Sequence	Sequences analysed	Percentage
Illumina	293	AGATCGGAAGAGC	27758	1.06
Nextera	21	CTGTCTCTTATA	27758	0.08
smallRNA	0	TGGAATTCTCGG	27758	0.00
Using Illumina adapter for trimming (count: 293). Second best hit was Nextera (count: 21)

Writing report to '/home/lkemp/snakemake_workshop/demo_workflow/results/trimmed/NA24694_1.fastq.gz_trimming_report.txt'

SUMMARISING RUN PARAMETERS
==========================
Input filename: ../../data/NA24694_1.fastq.gz
Trimming mode: paired-end
Trim Galore version: 0.6.7
Cutadapt version: 3.4
Python version: could not detect
Number of cores used for trimming: 2
Quality Phred score cutoff: 20
Quality encoding type selected: ASCII+33
Adapter sequence: 'AGATCGGAAGAGC' (Illumina TruSeq, Sanger iPCR; auto-detected)
Maximum trimming error rate: 0.1 (default)
Minimum required adapter overlap (stringency): 1 bp
Minimum required sequence length for both reads before a sequence pair gets removed: 20 bp
Output file(s) will be GZIP compressed

Cutadapt seems to be fairly up-to-date (version 3.4). Setting -j 2
Writing final adapter and quality trimmed output to NA24694_1_trimmed.fq.gz


  >>> Now performing quality (cutoff '-q 20') and adapter trimming in a single pass for the adapter sequence: 'AGATCGGAAGAGC' from file ../../data/NA24694_1.fastq.gz <<< 
This is cutadapt 3.4 with Python 3.9.6
Command line parameters: -j 2 -e 0.1 -q 20 -O 1 -a AGATCGGAAGAGC ../../data/NA24694_1.fastq.gz
Processing reads on 2 cores in single-end mode ...
Finished in 0.79 s (28 µs/read; 2.11 M reads/minute).

=== Summary ===

Total reads processed:                  27,758
Reads with adapters:                     8,243 (29.7%)
Reads written (passing filters):        27,758 (100.0%)

Total basepairs processed:     3,207,391 bp
Quality-trimmed:                  20,578 bp (0.6%)
Total written (filtered):      3,164,370 bp (98.7%)

=== Adapter 1 ===

Sequence: AGATCGGAAGAGC; Type: regular 3'; Length: 13; Trimmed: 8243 times

No. of allowed errors:
1-9 bp: 0; 10-13 bp: 1

Bases preceding removed adapters:
  A: 30.9%
  C: 28.9%
  G: 21.6%
  T: 18.4%
  none/other: 0.1%

Overview of removed sequences
length	count	expect	max.err	error counts
1	5094	6939.5	0	5094
2	2106	1734.9	0	2106
3	476	433.7	0	476
4	132	108.4	0	132
5	43	27.1	0	43
6	12	6.8	0	12
7	14	1.7	0	14
8	12	0.4	0	12
9	17	0.1	0	17
10	12	0.0	1	11 1
11	10	0.0	1	10
12	16	0.0	1	16
13	10	0.0	1	10
14	9	0.0	1	9
15	7	0.0	1	7
16	11	0.0	1	11
17	11	0.0	1	11
18	13	0.0	1	12 1
19	12	0.0	1	12
20	11	0.0	1	11
21	8	0.0	1	8
22	9	0.0	1	9
23	8	0.0	1	8
24	9	0.0	1	9
25	7	0.0	1	7
26	6	0.0	1	6
27	12	0.0	1	12
28	15	0.0	1	15
29	8	0.0	1	8
30	3	0.0	1	3
31	7	0.0	1	7
32	5	0.0	1	5
33	1	0.0	1	1
34	7	0.0	1	7
35	7	0.0	1	7
36	3	0.0	1	3
37	4	0.0	1	4
38	6	0.0	1	5 1
39	4	0.0	1	4
40	2	0.0	1	2
41	5	0.0	1	5
42	2	0.0	1	2
43	2	0.0	1	2
44	4	0.0	1	4
46	4	0.0	1	4
47	2	0.0	1	2
48	3	0.0	1	3
49	6	0.0	1	6
50	4	0.0	1	4
51	3	0.0	1	3
52	2	0.0	1	2
53	3	0.0	1	3
54	3	0.0	1	3
55	4	0.0	1	4
58	4	0.0	1	4
59	1	0.0	1	1
60	1	0.0	1	1
61	5	0.0	1	5
62	4	0.0	1	4
64	2	0.0	1	2
65	3	0.0	1	3
66	1	0.0	1	1
67	1	0.0	1	1
68	2	0.0	1	2
74	2	0.0	1	2
76	1	0.0	1	0 1
77	2	0.0	1	1 1
81	1	0.0	1	1
82	3	0.0	1	2 1
110	1	0.0	1	0 1
117	1	0.0	1	0 1
125	2	0.0	1	1 1

RUN STATISTICS FOR INPUT FILE: ../../data/NA24694_1.fastq.gz
=============================================
27758 sequences processed in total
The length threshold of paired-end sequences gets evaluated later on (in the validation step)

Writing report to '/home/lkemp/snakemake_workshop/demo_workflow/results/trimmed/NA24694_2.fastq.gz_trimming_report.txt'

SUMMARISING RUN PARAMETERS
==========================
Input filename: ../../data/NA24694_2.fastq.gz
Trimming mode: paired-end
Trim Galore version: 0.6.7
Cutadapt version: 3.4
Python version: could not detect
Number of cores used for trimming: 2
Quality Phred score cutoff: 20
Quality encoding type selected: ASCII+33
Adapter sequence: 'AGATCGGAAGAGC' (Illumina TruSeq, Sanger iPCR; auto-detected)
Maximum trimming error rate: 0.1 (default)
Minimum required adapter overlap (stringency): 1 bp
Minimum required sequence length for both reads before a sequence pair gets removed: 20 bp
Output file(s) will be GZIP compressed

Cutadapt seems to be fairly up-to-date (version 3.4). Setting -j -j 2
Writing final adapter and quality trimmed output to NA24694_2_trimmed.fq.gz


  >>> Now performing quality (cutoff '-q 20') and adapter trimming in a single pass for the adapter sequence: 'AGATCGGAAGAGC' from file ../../data/NA24694_2.fastq.gz <<< 
This is cutadapt 3.4 with Python 3.9.6
Command line parameters: -j 2 -e 0.1 -q 20 -O 1 -a AGATCGGAAGAGC ../../data/NA24694_2.fastq.gz
Processing reads on 2 cores in single-end mode ...
Finished in 0.79 s (29 µs/read; 2.10 M reads/minute).

=== Summary ===

Total reads processed:                  27,758
Reads with adapters:                     8,516 (30.7%)
Reads written (passing filters):        27,758 (100.0%)

Total basepairs processed:     3,220,570 bp
Quality-trimmed:                  33,277 bp (1.0%)
Total written (filtered):      3,159,712 bp (98.1%)

=== Adapter 1 ===

Sequence: AGATCGGAAGAGC; Type: regular 3'; Length: 13; Trimmed: 8516 times

No. of allowed errors:
1-9 bp: 0; 10-13 bp: 1

Bases preceding removed adapters:
  A: 33.2%
  C: 27.8%
  G: 20.5%
  T: 18.4%
  none/other: 0.1%

Overview of removed sequences
length	count	expect	max.err	error counts
1	5176	6939.5	0	5176
2	2110	1734.9	0	2110
3	426	433.7	0	426
4	128	108.4	0	128
5	53	27.1	0	53
6	25	6.8	0	25
7	22	1.7	0	22
8	23	0.4	0	23
9	21	0.1	0	21
10	26	0.0	1	25 1
11	22	0.0	1	22
12	18	0.0	1	17 1
13	17	0.0	1	17
14	25	0.0	1	24 1
15	16	0.0	1	15 1
16	20	0.0	1	19 1
17	22	0.0	1	22
18	13	0.0	1	13
19	20	0.0	1	20
20	11	0.0	1	10 1
21	9	0.0	1	8 1
22	20	0.0	1	20
23	17	0.0	1	15 2
24	9	0.0	1	8 1
25	6	0.0	1	6
26	16	0.0	1	16
27	10	0.0	1	10
28	9	0.0	1	9
29	6	0.0	1	6
30	12	0.0	1	12
31	9	0.0	1	8 1
32	21	0.0	1	21
33	12	0.0	1	12
34	11	0.0	1	11
35	10	0.0	1	10
36	10	0.0	1	10
37	10	0.0	1	10
38	6	0.0	1	6
39	6	0.0	1	6
40	5	0.0	1	5
41	6	0.0	1	6
42	9	0.0	1	9
44	6	0.0	1	6
45	11	0.0	1	11
46	4	0.0	1	4
47	2	0.0	1	2
48	7	0.0	1	7
49	1	0.0	1	1
50	4	0.0	1	4
51	3	0.0	1	3
52	2	0.0	1	2
53	3	0.0	1	3
54	2	0.0	1	2
55	3	0.0	1	3
56	1	0.0	1	1
57	1	0.0	1	1
58	5	0.0	1	5
59	1	0.0	1	1
60	3	0.0	1	3
61	5	0.0	1	5
62	3	0.0	1	3
63	3	0.0	1	3
64	1	0.0	1	1
65	1	0.0	1	1
66	2	0.0	1	2
67	1	0.0	1	1
68	7	0.0	1	6 1
69	1	0.0	1	1
70	2	0.0	1	1 1
71	2	0.0	1	2
73	1	0.0	1	1
93	1	0.0	1	1
123	1	0.0	1	0 1
124	1	0.0	1	1
125	2	0.0	1	0 2

RUN STATISTICS FOR INPUT FILE: ../../data/NA24694_2.fastq.gz
=============================================
27758 sequences processed in total
The length threshold of paired-end sequences gets evaluated later on (in the validation step)

Validate paired-end files NA24694_1_trimmed.fq.gz and NA24694_2_trimmed.fq.gz
file_1: NA24694_1_trimmed.fq.gz, file_2: NA24694_2_trimmed.fq.gz


>>>>> Now validing the length of the 2 paired-end infiles: NA24694_1_trimmed.fq.gz and NA24694_2_trimmed.fq.gz <<<<<
Writing validated paired-end Read 1 reads to NA24694_1_val_1.fq.gz
Writing validated paired-end Read 2 reads to NA24694_2_val_2.fq.gz

Total number of sequences analysed: 27758

Number of sequence pairs removed because at least one read was shorter than the length cutoff (20 bp): 76 (0.27%)

Deleting both intermediate output files NA24694_1_trimmed.fq.gz and NA24694_2_trimmed.fq.gz

====================================================================================================

